{"$schema":"https://json-schema.org/draft/2020-12/schema","$id":"https://ninetaild.github.io/form/kits/schema.json","title":"Event Kit","type":"object","required":["version","eventName","url","answers"],"properties":{"version":{"const":1},"eventName":{"type":"string","minLength":1},"url":{"type":"string","format":"uri"},"answers":{"type":"array","minItems":1,"items":{"type":"string","minLength":1}}},"additionalProperties":false}