{
  "version": 1,
  "eventName": "한국교육학술정보원 <2026년 KERIS 신사업 아이디어 공모전 국민심사>",
  "url": "https://sotong.go.kr/fron/jdgmn/jdgmnView.do?menu_id=393&qustnr_id=3fd2b3433ccd4d36a8394bc2e7e18623&searchQustnrSttusCode=&search_sj_cn=&search_orgNm=&search_code=&search_txt=&qustnr_bgnde=&qustnr_endde=&date_range=&orderBy=&miv_pageNo=1",
  "answers": [
    "."
  ]
}