{
  "version": 1,
  "eventName": "행정안전부 <2026년 디지털서비스 개방 성과공유회 우수 서비스 심사>",
  "url": "https://sotong.go.kr/fron/jdgmn/jdgmnView.do?menu_id=393&qustnr_id=fa5b66e3376d41efb5696b7058083928&searchQustnrSttusCode=&search_sj_cn=&search_orgNm=&search_code=&search_txt=&qustnr_bgnde=&qustnr_endde=&date_range=&orderBy=&miv_pageNo=1",
  "answers": [
    ""
  ]
}